"","question","a","b","c","d","questionID","answer","detail"
"1","Which of the following factors is NOT considered to be a component of an infectious disease system?","The pathogen that causes the disease","The host population that the pathogen infects","The environment in which the pathogen and host interact","The stock market",1,"d","The stock market"
"2","Which of the following is NOT a characteristic of a complex adaptive system?","Nonlinear relationships","Feedback loops","Predetermined outcomes","Self-organization",2,"c","Predetermined outcomes"
"3","What is the role of herd immunity in controlling the spread of an infectious disease?","It increases the susceptibility of the population to the disease","It reduces the number of individuals who can contract the disease","It eliminates the disease completely","It increases the virulence of the pathogen",3,"b","It reduces the number of individuals who can contract the disease"
"4","How does a change in the environment, such as an increase in temperature, affect the transmission of an infectious disease?","It has no effect","It increases the transmission of the disease","It decreases the transmission of the disease","It can have either effect depending on the pathogen and host",4,"d","It can have either effect depending on the pathogen and host"
"5","How do interventions, such as vaccination programs or quarantine measures, affect the dynamics of an infectious disease system?","They have no effect","They increase the spread of the disease","They decrease the spread of the disease","They can have either effect depending on the specific intervention and the context of the system",5,"d","They can have either effect depending on the specific intervention and the context of the system"
"6","What is an example of a feedback loop in an infectious disease system?","An increase in the number of infected individuals leads to an increase in the number of deaths","An increase in the number of vaccinated individuals leads to a decrease in the number of susceptible individuals","An increase in the number of infected individuals leads to an increase in the number of susceptible individuals","An increase in the number of susceptible individuals leads to an increase in the number of infected individuals",6,"d","An increase in the number of susceptible individuals leads to an increase in the number of infected individuals"
"7","How does globalization affect the dynamics of infectious disease systems?","It has no effect","It increases the spread of diseases","It decreases the spread of diseases","It can have either effect depending on the specific context and the disease in question",7,"d","It can have either effect depending on the specific context and the disease in question"
